Property ID,Property                                        ,Original                                                               ,Google Translate                                                                 ,Human checked,Google Translate
P175       ,performer                                       ,Who sang XXX?                                                          ,¿Quién cantó XXX?                                                                ,¿Quién cantó XXX?,¿Quién cantó XXX?
P175       ,performer                                       ,Which performer released XXX as it's album?                            ,¿Qué artista lanzó XXX como álbum?                                               ,¿Qué artista lanzó YYY XXX como álbum?,¿Qué artista lanzó XXX como álbum?
P175       ,performer                                       ,What is the name of the artist or group which originally performed XXX?,¿Cuál es el nombre del artista o grupo que originalmente realizó XXX?            ,,¿Cuál es el nombre del artista o grupo que originalmente realizó XXX?
P175       ,performer                                       ,Whose performance is XXX?                                              ,¿De quién es la actuación XXX?                                                   ,,¿De quién es la actuación XXX?
P175       ,performer                                       ,Who sang or played XXX?                                                ,¿Quién cantó o jugó XXX?                                                         ,¿Quién cantó o jugó XXX?,¿Quién cantó o jugó XXX?
P175       ,performer                                       ,Who released XXX album?                                                ,¿Quién lanzó el álbum XXX?                                                       ,¿Quién lanzó el álbum XXX?,¿Quién lanzó el álbum XXX?
P175       ,performer                                       ,Which performer released the album XXX?                                ,¿Qué artista lanzó el álbum XXX?                                                 ,,¿Qué artista lanzó el álbum XXX?
P175       ,performer                                       ,Which artist or group performed XXX?                                   ,¿Qué artista o grupo realizó XXX?                                                ,¿Qué artista o grupo realizó XXX?,¿Qué artista o grupo realizó XXX?
P175       ,performer                                       ,What was XXX's performers name?                                        ,¿Cuál era el nombre de los artistas de XXX?                                      ,¿Cuál era el nombre de los artistas de XXX?,¿Cuál era el nombre de los artistas de XXX?
P175       ,performer                                       ,What is the name of the performer that released the album XXX?         ,¿Cuál es el nombre del artista que lanzó el álbum XXX?                           ,¿Cuál es el nombre del artista que lanzó el álbum XXX?,¿Cuál es el nombre del artista que lanzó el álbum XXX?
P175       ,performer                                       ,What artist released XXX?                                              ,¿Qué artista lanzó XXX?                                                          ,,¿Qué artista lanzó XXX?
P175       ,performer                                       ,To which performer does the album XXX belong?                          ,¿A qué intérprete pertenece el álbum XXX?                                        ,¿A qué intérprete pertenece el álbum YYY XXX?,¿A qué intérprete pertenece el álbum XXX?
P175       ,performer                                       ,Who was the performer of XXX?                                          ,¿Quién fue el intérprete de XXX?                                                 ,,¿Quién fue el intérprete de XXX?
P175       ,performer                                       ,Who is the performer of XXX?                                           ,¿Quién es el intérprete de XXX?                                                  ,,¿Quién es el intérprete de XXX?
P175       ,performer                                       ,The song or album XXX came from which artiste?                         ,La canción o el álbum XXX vinieron de qué artista?                               ,,La canción o el álbum XXX vinieron de qué artista?
P175       ,performer                                       ,Who is the artist of XXX?                                              ,¿Quién es el artista de XXX?                                                     ,¿Quién es el artista de YYY XXX?,¿Quién es el artista de XXX?
P175       ,performer                                       ,Who performed XXX?                                                     ,¿Quién realizó XXX?                                                              ,¿Quién realizó YYY XXX?,¿Quién realizó XXX?
P175       ,performer                                       ,Who originally recorded XXX?                                           ,¿Quién grabó originalmente XXX?                                                  ,,¿Quién grabó originalmente XXX?
P175       ,performer                                       ,Which singer-songwriter is XXX the fifth studio album of?              ,¿De qué cantautor es XXX el quinto álbum de estudio de?                          ,,¿De qué cantautor es XXX el quinto álbum de estudio de?
P175       ,performer                                       ,Which artist is XXX co-written and recorded by?                        ,¿Qué artista es XXX coescrito y grabado por?                                     ,¿Qué artista grabó y fue coautor de XXX?,¿Qué artista es XXX coescrito y grabado por?
P175       ,performer                                       ,Which performer released XXX?                                          ,¿Qué artista lanzó XXX?                                                          ,,¿Qué artista lanzó XXX?
P175       ,performer                                       ,The song XXX is by what artist?                                        ,¿La canción XXX es de qué artista?                                               ,¿La canción XXX es de qué artista?,¿La canción XXX es de qué artista?
P19        ,place of birth                                  ,In what city was XXX born?                                             ,¿En qué ciudad nació XXX?                                                        ,¿En qué ciudad nació XXX?,¿En qué ciudad nació XXX?
P19        ,place of birth                                  ,Which city was the birthplace of XXX?                                  ,¿Qué ciudad fue la cuna de XXX?                                                  ,,¿Qué ciudad fue la cuna de XXX?
P19        ,place of birth                                  ,What city was XXX born in?                                             ,¿En qué ciudad nació XXX?                                                        ,,¿En qué ciudad nació XXX?
P19        ,place of birth                                  ,In what city was XXX born in?                                          ,¿En qué ciudad nació XXX?                                                        ,,¿En qué ciudad nació XXX?
P19        ,place of birth                                  ,What is the name of the city XXX was born in?                          ,¿Cuál es el nombre de la ciudad donde nació XXX?                                 ,¿Cuál es el nombre de la ciudad donde nació XXX?,¿Cuál es el nombre de la ciudad donde nació XXX?
P19        ,place of birth                                  ,What city was XXX born?                                                ,¿En qué ciudad nació XXX?                                                        ,,¿En qué ciudad nació XXX?
P19        ,place of birth                                  ,What is the birth place of XXX?                                        ,¿Cuál es el lugar de nacimiento de XXX?                                          ,¿Cuál es el lugar de nacimiento de XXX?,¿Cuál es el lugar de nacimiento de XXX?
P19        ,place of birth                                  ,What is XXX's birthplace?                                              ,¿Cuál es el lugar de nacimiento de XXX?                                          ,,¿Cuál es el lugar de nacimiento de XXX?
P19        ,place of birth                                  ,What is the birthplace of XXX?                                         ,¿Cuál es el lugar de nacimiento de XXX?                                          ,,¿Cuál es el lugar de nacimiento de XXX?
P19        ,place of birth                                  ,What was XXX's city of birth?                                          ,¿Cuál fue la ciudad de nacimiento de XXX?                                        ,,¿Cuál fue la ciudad de nacimiento de XXX?
P19        ,place of birth                                  ,What is the city of birth of XXX?                                      ,¿Cuál es la ciudad de nacimiento de XXX?                                         ,,¿Cuál es la ciudad de nacimiento de XXX?
P19        ,place of birth                                  ,Where was XXX born?                                                    ,¿Dónde nació XXX?                                                                ,,¿Dónde nació XXX?
P19        ,place of birth                                  ,What is the place of birth of XXX?                                     ,¿Cuál es el lugar de nacimiento de XXX?                                          ,,¿Cuál es el lugar de nacimiento de XXX?
P19        ,place of birth                                  ,Where was XXX born in?                                                 ,¿Dónde nació XXX?                                                                ,,¿Dónde nació XXX?
P119       ,place of burial                                 ,What cemetery is XXX located in?                                       ,¿En qué cementerio se encuentra XXX?                                             ,¿En qué cementerio se encuentra XXX?,¿En qué cementerio se encuentra XXX?
P119       ,place of burial                                 ,What cemetery is XXX buried in?                                        ,¿En qué cementerio está enterrado XXX?                                           ,,¿En qué cementerio está enterrado XXX?
P119       ,place of burial                                 ,What cemetery was XXX baried in?                                       ,¿En qué cementerio fue enterrado XXX?                                            ,,¿En qué cementerio fue enterrado XXX?
P119       ,place of burial                                 ,What cemetery was XXX buried ar?                                       ,¿En qué cementerio se enterró XXX ar?                                            ,,¿En qué cementerio se enterró XXX ar?
P119       ,place of burial                                 ,In which cemetary is XXX buried?                                       ,¿En qué cementerio está enterrado XXX?                                           ,,¿En qué cementerio está enterrado XXX?
P119       ,place of burial                                 ,What is the place of burial of XXX?                                    ,¿Cuál es el lugar de enterramiento de XXX?                                       ,,¿Cuál es el lugar de enterramiento de XXX?
P119       ,place of burial                                 ,What is the place of burial for XXX?                                   ,¿Cuál es el lugar de enterramiento para XXX?                                     ,,¿Cuál es el lugar de enterramiento para XXX?
P119       ,place of burial                                 ,Where was XXX burried?                                                 ,¿Dónde estaba XXX enterrado?                                                     ,,¿Dónde estaba XXX enterrado?
P119       ,place of burial                                 ,Where was the body of XXX buried?                                      ,¿Dónde fue enterrado el cuerpo de XXX?                                           ,¿Dónde fue enterrado el cuerpo de XXX?,¿Dónde fue enterrado el cuerpo de XXX?
P119       ,place of burial                                 ,The final resting place of XXX is at what cemetery?                    ,¿El lugar de descanso final de XXX es en qué cementerio?                         ,,¿El lugar de descanso final de XXX es en qué cementerio?
P119       ,place of burial                                 ,At what cemetery is XXX buried?                                        ,¿En qué cementerio está enterrado XXX?                                           ,¿En qué cementerio está enterrado XXX?,¿En qué cementerio está enterrado XXX?
P119       ,place of burial                                 ,What is the name of the cemetery that XXX was buried at?               ,¿Cuál es el nombre del cementerio en el que XXX fue enterrado?                   ,¿Cuál es el nombre del cementerio en el que XXX fue enterrado?,¿Cuál es el nombre del cementerio en el que XXX fue enterrado?
P20        ,place of death                                  ,At what location did XXX die?                                          ,¿En qué lugar murió XXX?                                                         ,¿En qué lugar murió XXX?,¿En qué lugar murió XXX?
P20        ,place of death                                  ,In what place did XXX die?                                             ,¿En qué lugar murió XXX?                                                         ,,¿En qué lugar murió XXX?
P20        ,place of death                                  ,Where did XXX live when he died?                                       ,¿Dónde vivió XXX cuando murió?                                                   ,,¿Dónde vivió XXX cuando murió?
P20        ,place of death                                  ,What city did XXX live when he died?                                   ,¿En qué ciudad vivió XXX cuando murió?                                           ,¿En qué ciudad vivía XXX cuando murió?,¿En qué ciudad vivió XXX cuando murió?
P20        ,place of death                                  ,In what city did XXX die?                                              ,¿En qué ciudad murió XXX?                                                        ,¿En qué ciudad murió XXX?,¿En qué ciudad murió XXX?
P585       ,point in time                                   ,What date is associated with XXX?                                      ,¿Qué fecha está asociada con XXX?                                                ,,¿Qué fecha está asociada con XXX?
P585       ,point in time                                   ,When did XXX occurr?                                                   ,¿Cuándo ocurrió XXX?                                                             ,,¿Cuándo ocurrió XXX?
P585       ,point in time                                   ,The point in time of XXX was when?                                     ,El punto en el tiempo de XXX fue ¿cuándo?                                        ,,El punto en el tiempo de XXX fue ¿cuándo?
P585       ,point in time                                   ,What was the date of XXX?                                              ,¿Cuál fue la fecha de XXX?                                                       ,¿Cuál fue la fecha de XXX?,¿Cuál fue la fecha de XXX?
P585       ,point in time                                   ,The date of XXX?                                                       ,La fecha de XXX?                                                                 ,,La fecha de XXX?
P585       ,point in time                                   ,On what date did XXX occur?                                            ,¿En qué fecha ocurrió XXX?                                                       ,,¿En qué fecha ocurrió XXX?
P585       ,point in time                                   ,The point in time of XXX was what?                                     ,¿El punto en el tiempo de XXX fue qué?                                           ,,¿El punto en el tiempo de XXX fue qué?
P585       ,point in time                                   ,On what date did XXX take place?                                       ,¿En qué fecha tuvo lugar XXX?                                                    ,,¿En qué fecha tuvo lugar XXX?
P585       ,point in time                                   ,The date of XXX was what?                                              ,¿La fecha de XXX fue qué?                                                        ,,¿La fecha de XXX fue qué?
P585       ,point in time                                   ,What is the full date that XXX crashed on?                             ,¿Cuál es la fecha completa en la que XXX se estrelló?                            ,¿Cuál es la fecha completa en la que YYY XXX se estrelló?,¿Cuál es la fecha completa en la que XXX se estrelló?
P585       ,point in time                                   ,What is the date when XXX happened?                                    ,¿Cuál es la fecha en que sucedió XXX?                                            ,,¿Cuál es la fecha en que sucedió XXX?
P585       ,point in time                                   ,When did XXX occur?                                                    ,¿Cuándo ocurrió XXX?                                                             ,,¿Cuándo ocurrió XXX?
P39        ,position held                                   ,What is the position of XXX?                                           ,¿Cuál es la posición de XXX?                                                     ,¿Cuál es la posición de XXX?,¿Cuál es la posición de XXX?
P39        ,position held                                   ,Which position was held by XXX?                                        ,¿Qué posición ocupaba XXX?                                                       ,¿Qué posición ocupaba XXX?,¿Qué posición ocupaba XXX?
P39        ,position held                                   ,Which was the position that XXX held?                                  ,¿Cuál fue el cargo que mantuvo XXX?                                              ,,¿Cuál fue el cargo que mantuvo XXX?
P413       ,position played on team / speciality            ,Which player position has been assigned to XXX?                        ,¿Qué posición de jugador ha sido asignada a XXX?                                 ,,¿Qué posición de jugador ha sido asignada a XXX?
P413       ,position played on team / speciality            ,What was the position of XXX?                                          ,¿Cuál era la posición de XXX?                                                    ,,¿Cuál era la posición de XXX?
P413       ,position played on team / speciality            ,What role does XXX play in football?                                   ,¿Qué papel juega XXX en el fútbol?                                               ,¿Qué papel juega XXX en el fútbol?,¿Qué papel juega XXX en el fútbol?
P413       ,position played on team / speciality            ,What is the position XXX plays in football?                            ,¿Cuál es la posición que juega XXX en el fútbol?                                 ,¿Cuál es la posición que juega XXX en el fútbol?,¿Cuál es la posición que juega XXX en el fútbol?
P413       ,position played on team / speciality            ,What is XXX's position in football?                                    ,¿Cuál es la posición de XXX en el fútbol?                                        ,,¿Cuál es la posición de XXX en el fútbol?
P413       ,position played on team / speciality            ,In which position does XXX play?                                       ,¿En qué posición juega XXX?                                                      ,¿En qué posición juega XXX?,¿En qué posición juega XXX?
P413       ,position played on team / speciality            ,What was XXX's position?                                               ,¿Cuál era la posición de XXX?                                                    ,¿Cuál era la posición de XXX?,¿Cuál era la posición de XXX?
P413       ,position played on team / speciality            ,What position was played by XXX?                                       ,¿Qué posición jugó XXX?                                                          ,,¿Qué posición jugó XXX?
P413       ,position played on team / speciality            ,What is XXX's position on the field while playing football?            ,¿Cuál es la posición de XXX en el campo al jugar al fútbol?                      ,,¿Cuál es la posición de XXX en el campo al jugar al fútbol?
P413       ,position played on team / speciality            ,What was XXX specialty in their profesisonal sport?                    ,¿Qué era la XXX especialidad en su deporte profesional?                          ,,¿Qué era la XXX especialidad en su deporte profesional?
P413       ,position played on team / speciality            ,What position does XXX play on the field?                              ,¿Qué posición juega XXX en el campo?                                             ,,¿Qué posición juega XXX en el campo?
P413       ,position played on team / speciality            ,What football position did XXX play?                                   ,¿Qué posición de fútbol jugó XXX?                                                ,,¿Qué posición de fútbol jugó XXX?
P413       ,position played on team / speciality            ,In what capacity did XXX play football?                                ,¿En qué capacidad jugó el fútbol XXX?                                            ,,¿En qué capacidad jugó el fútbol XXX?
P413       ,position played on team / speciality            ,"In football, which position does XXX play?"                           ,"En el fútbol, ​​¿en qué posición juega XXX?"                                    ,"En el fútbol, ​​¿en qué posición juega XXX?"
P413       ,position played on team / speciality            ,At what position on the field did XXX play football?                   ,¿En qué posición en el campo jugó XXX al fútbol?                                 ,,¿En qué posición en el campo jugó XXX al fútbol?
P413       ,position played on team / speciality            ,What position did XXX play?                                            ,¿Qué posición jugó XXX?                                                          ,¿Qué posición jugó XXX?,¿Qué posición jugó XXX?
P413       ,position played on team / speciality            ,Which player position has been associated with XXX?                    ,¿Qué posición de jugador se ha asociado con XXX?                                 ,¿Con qué posición se asocia XXX?,¿Qué posición de jugador se ha asociado con XXX?
P413       ,position played on team / speciality            ,What position does XXX play?                                           ,¿Qué posición juega XXX?                                                         ,,¿Qué posición juega XXX?
P413       ,position played on team / speciality            ,What position did XXX play in football?                                ,¿Qué posición jugó XXX en el fútbol?                                             ,,¿Qué posición jugó XXX en el fútbol?
P413       ,position played on team / speciality            ,What is the football position of XXX?                                  ,¿Cuál es la posición de fútbol de XXX?                                           ,,¿Cuál es la posición de fútbol de XXX?
P413       ,position played on team / speciality            ,What is the position that XXX plays called?                            ,¿Cuál es la posición que juega XXX?                                              ,,¿Cuál es la posición que juega XXX?
P413       ,position played on team / speciality            ,What position in football did XXX play?                                ,¿Qué posición en el fútbol jugó XXX?                                             ,¿Qué posición jugó XXX en el fútbol ?,¿Qué posición en el fútbol jugó XXX?
P413       ,position played on team / speciality            ,Which player position does XXX belong to?                              ,¿A qué posición del jugador pertenece XXX?                                       ,,¿A qué posición del jugador pertenece XXX?
P413       ,position played on team / speciality            ,Which is the position of XXX?                                          ,¿Cuál es la posición de XXX?                                                     ,¿Cuál es la posición de XXX?,¿Cuál es la posición de XXX?
P413       ,position played on team / speciality            ,What field position does XXX play?                                     ,¿Qué posición de campo juega XXX?                                                ,¿Qué posición de campo juega XXX?,¿Qué posición de campo juega XXX?
P413       ,position played on team / speciality            ,What position is played by XXX?                                        ,¿Qué posición juega XXX?                                                         ,,¿Qué posición juega XXX?
