Property ID,Property                                        ,Original                                                               ,Google Translate                                                                 ,Human checked,Google Translate
P177       ,crosses                                         ,What does XXX cross over?                                              ,¿Qué cruza XXX sobre?                                                            ,,¿Qué cruza XXX sobre?
P569       ,date of birth                                   ,When was XXX born?                                                     ,¿Cuándo nació XXX?                                                               ,¿Cuándo nació XXX?,¿Cuándo nació XXX?
P569       ,date of birth                                   ,When was the birth of XXX?                                             ,¿Cuándo fue el nacimiento de XXX?                                                ,¿Cuándo fue el nacimiento de XXX?,¿Cuándo fue el nacimiento de XXX?
P569       ,date of birth                                   ,When is the date of birth of XXX?                                      ,¿Cuándo es la fecha de nacimiento de XXX?                                        ,¿Cuándo es la fecha de nacimiento de XXX?,¿Cuándo es la fecha de nacimiento de XXX?
P569       ,date of birth                                   ,What was the date of birth of XXX?                                     ,¿Cuál fue la fecha de nacimiento de XXX?                                         ,¿Cuál fue la fecha de nacimiento de XXX?,¿Cuál fue la fecha de nacimiento de XXX?
P569       ,date of birth                                   ,What is the date of birth for XXX?                                     ,¿Cuál es la fecha de nacimiento de XXX?                                          ,¿Cuál es la fecha de nacimiento de XXX?,¿Cuál es la fecha de nacimiento de XXX?
P569       ,date of birth                                   ,What is the birth date of XXX?                                         ,¿Cuál es la fecha de nacimiento de XXX?                                          ,,¿Cuál es la fecha de nacimiento de XXX?
P569       ,date of birth                                   ,The date of birth of XXX is?                                           ,La fecha de nacimiento de XXX es?                                                ,,La fecha de nacimiento de XXX es?
P569       ,date of birth                                   ,The date of birth for XXX is what?                                     ,¿La fecha de nacimiento de XXX es qué?                                           ,,¿La fecha de nacimiento de XXX es qué?
P569       ,date of birth                                   ,The birth date of XXX is what?                                         ,¿La fecha de nacimiento de XXX es qué?                                           ,,¿La fecha de nacimiento de XXX es qué?
P570       ,date of death                                   ,Which is the date of death for XXX?                                    ,¿Cuál es la fecha de la muerte de XXX?                                           ,¿Cuál es la fecha de la muerte de XXX?,¿Cuál es la fecha de la muerte de XXX?
P570       ,date of death                                   ,When did XXX's death occur?                                            ,¿Cuándo ocurrió la muerte de XXX?                                                ,,¿Cuándo ocurrió la muerte de XXX?
P570       ,date of death                                   ,What was the date of death of XXX?                                     ,¿Cuál fue la fecha de la muerte de XXX?                                          ,¿Cuál fue la fecha de la muerte de XXX?,¿Cuál fue la fecha de la muerte de XXX?
P570       ,date of death                                   ,What was the date of death for XXX?                                    ,¿Cuál fue la fecha de la muerte de XXX?                                          ,,¿Cuál fue la fecha de la muerte de XXX?
P570       ,date of death                                   ,What is the date of death for XXX?                                     ,¿Cuál es la fecha de la muerte de XXX?                                           ,,¿Cuál es la fecha de la muerte de XXX?
P570       ,date of death                                   ,What date did XXX die?                                                 ,¿En qué fecha murió XXX?                                                         ,¿En qué fecha murió XXX?,¿En qué fecha murió XXX?
P570       ,date of death                                   ,The year XXX died was what?                                            ,¿El año XXX murió fue qué?                                                       ,,¿El año XXX murió fue qué?
P570       ,date of death                                   ,When did the life of XXX end?                                          ,¿Cuándo terminó la vida de XXX?                                                  ,,¿Cuándo terminó la vida de XXX?
P570       ,date of death                                   ,When did XXX die?                                                      ,¿Cuándo murió XXX?                                                               ,¿Cuándo murió XXX?,¿Cuándo murió XXX?
P570       ,date of death                                   ,What was the death date of XXX?                                        ,¿Cuál fue la fecha de muerte del XX?                                             ,,¿Cuál fue la fecha de muerte del XX?
P570       ,date of death                                   ,What was the date of XXX's death?                                      ,¿Cuál fue la fecha de la muerte de XXX?                                          ,,¿Cuál fue la fecha de la muerte de XXX?
P570       ,date of death                                   ,What is the date of XXX's death?                                       ,¿Cuál es la fecha de la muerte de XXX?                                           ,,¿Cuál es la fecha de la muerte de XXX?
P570       ,date of death                                   ,The death of XXX occured on what date?                                 ,La muerte de XXX ocurrió en qué fecha?                                           ,,La muerte de XXX ocurrió en qué fecha?
P570       ,date of death                                   ,The date of death for XXX is what?                                     ,¿La fecha de la muerte para XXX es qué?                                          ,,¿La fecha de la muerte para XXX es qué?
P570       ,date of death                                   ,On which date did XXX die?                                             ,¿En qué fecha murió XXX?                                                         ,,¿En qué fecha murió XXX?
P570       ,date of death                                   ,On what date did XXX die?                                              ,¿En qué fecha murió XXX?                                                         ,,¿En qué fecha murió XXX?
P570       ,date of death                                   ,When was XXX's death?                                                  ,¿Cuándo fue la muerte de XXX?                                                    ,,¿Cuándo fue la muerte de XXX?
P570       ,date of death                                   ,On what date did XXX expire?                                           ,¿En qué fecha expiró XXX?                                                        ,,¿En qué fecha expiró XXX?
P570       ,date of death                                   ,What year did XXX die?                                                 ,¿En qué año murió XXX?                                                           ,,¿En qué año murió XXX?
P570       ,date of death                                   ,What year did XXX die in?                                              ,¿En qué año murió XXX?                                                           ,,¿En qué año murió XXX?
P570       ,date of death                                   ,What date did XXX die on?                                              ,¿En qué fecha murió XXX?                                                         ,,¿En qué fecha murió XXX?
P1619      ,date of official opening                        ,When was the opening of XXX?                                           ,¿Cuándo fue la apertura de XXX?                                                  ,¿Cuándo fue la apertura deYYY XXX?,¿Cuándo fue la apertura de XXX?
P1619      ,date of official opening                        ,What was the date of the opening of XXX?                               ,¿Cuál fue la fecha de la apertura de XXX?                                        ,¿Cuál fue la fecha de la apertura deYYY XXX?,¿Cuál fue la fecha de la apertura de XXX?
P1619      ,date of official opening                        ,When was the official opening of XXX?                                  ,¿Cuándo fue la inauguración oficial de XXX?                                      ,¿Cuándo fue la inauguración oficial deYYY XXX?,¿Cuándo fue la inauguración oficial de XXX?
P1619      ,date of official opening                        ,When was XXX opened?                                                   ,¿Cuándo se abrió XXX?                                                            ,,¿Cuándo se abrió XXX?
P1619      ,date of official opening                        ,When was XXX founded?                                                  ,¿Cuándo fue fundada XXX?                                                         ,¿Cuándo fue fundadGGG YYY XXX?,¿Cuándo fue fundada XXX?
P1619      ,date of official opening                        ,When was XXX created?                                                  ,¿Cuándo se creó XXX?                                                             ,¿Cuándo se creó YYY XXX?,¿Cuándo se creó XXX?
P1619      ,date of official opening                        ,When did XXX open?                                                     ,¿Cuándo abrió XXX?                                                               ,,¿Cuándo abrió XXX?
P1619      ,date of official opening                        ,When did XXX begin?                                                    ,¿Cuándo comenzó XXX?                                                             ,,¿Cuándo comenzó XXX?
P1619      ,date of official opening                        ,When date was the official opening of XXX?                             ,Cuando fecha fue la inauguración oficial de XXX?                                 ,,Cuando fecha fue la inauguración oficial de XXX?
P1619      ,date of official opening                        ,When was XXX founded/built?                                            ,¿Cuándo se fundó / construyó XXX?                                                ,,¿Cuándo se fundó / construyó XXX?
P1619      ,date of official opening                        ,What was the date of the official opening of XXX?                      ,¿Cuál fue la fecha de la inauguración oficial de XXX?                            ,¿Cuál fue la fecha de la inauguración oficial deYYY XXX?,¿Cuál fue la fecha de la inauguración oficial de XXX?
P1619      ,date of official opening                        ,When was XXX started?                                                  ,¿Cuándo comenzó XXX?                                                             ,,¿Cuándo comenzó XXX?
P1619      ,date of official opening                        ,What year was XXX opened?                                              ,¿En qué año se abrió XXX?                                                        ,,¿En qué año se abrió XXX?
P1619      ,date of official opening                        ,When was XXX opened officially?                                        ,¿Cuándo se inauguró XXX oficialmente?                                            ,¿Cuándo se inauguró YYY XXX oficialmente?,¿Cuándo se inauguró XXX oficialmente?
P287       ,designer                                        ,Who worked on designing XXX?                                           ,¿Quién trabajó en el diseño de XXX?                                              ,¿Quién trabajó en el diseño deYYY XXX?,¿Quién trabajó en el diseño de XXX?
P287       ,designer                                        ,What is the name of the person who designed XXX?                       ,¿Cuál es el nombre de la persona que diseñó XXX?                                 ,,¿Cuál es el nombre de la persona que diseñó XXX?
P287       ,designer                                        ,Who designed the XXX?                                                  ,¿Quién diseñó el XXX?                                                            ,¿Quién diseñó YYY XXX?,¿Quién diseñó el XXX?
P287       ,designer                                        ,Who desigened XXX?                                                     ,¿Quién diseñó XXX?                                                               ,,¿Quién diseñó XXX?
P287       ,designer                                        ,Which is the designer of XXX?                                          ,¿Cuál es el diseñador de XXX?                                                    ,,¿Cuál es el diseñador de XXX?
P287       ,designer                                        ,Who is the designer of XXX?                                            ,¿Quién es el diseñador de XXX?                                                   ,¿Quién es el diseñador de YYY XXX?,¿Quién es el diseñador de XXX?
P287       ,designer                                        ,Who worked on XXX?                                                     ,¿Quién trabajó en XXX?                                                           ,¿Quién trabajó en YYY XXX?,¿Quién trabajó en XXX?
P178       ,developer                                       ,With which development company would you associate XXX?                ,¿Con qué empresa de desarrollo asociarías XXX?                                   ,¿Con qué empresa de desarrollo asociarías a XXX?,¿Con qué empresa de desarrollo asociarías XXX?
P178       ,developer                                       ,Who is the developer of XXX?                                           ,¿Quién es el desarrollador de XXX?                                               ,,¿Quién es el desarrollador de XXX?
P178       ,developer                                       ,Which developer released XXX?                                          ,¿Qué desarrollador lanzó XXX?                                                    ,,¿Qué desarrollador lanzó XXX?
P178       ,developer                                       ,Which company developed the videogame XXX?                             ,¿Qué empresa desarrolló el videojuego XXX?                                       ,¿Qué empresa desarrolló el videojuego XXX?,¿Qué empresa desarrolló el videojuego XXX?
P178       ,developer                                       ,What is the name of XXX's developer?                                   ,¿Cuál es el nombre del desarrollador de XXX?                                     ,¿Cuál es el nombre del desarrollador deYYY XXX?,¿Cuál es el nombre del desarrollador de XXX?
P178       ,developer                                       ,Which company developed XXX?                                           ,¿Qué empresa desarrolló XXX?                                                     ,¿Qué empresa desarrolló YYY XXX?,¿Qué empresa desarrolló XXX?
P178       ,developer                                       ,Who is originally behind the development of XXX?                       ,¿Quién está originalmente detrás del desarrollo de XXX?                          ,,¿Quién está originalmente detrás del desarrollo de XXX?
P178       ,developer                                       ,By whom was XXX developed?                                             ,¿Por quién fue desarrollado XXX?                                                 ,¿Por quién fue desarrolladGGG YYY XXX?,¿Por quién fue desarrollado XXX?
P57        ,director                                        ,Who was the person who directed XXX?                                   ,¿Quién fue la persona que dirigió XXX?                                           ,,¿Quién fue la persona que dirigió XXX?
P57        ,director                                        ,Who was the director of XXX?                                           ,¿Quién fue el director de XXX?                                                   ,¿Quién fue el director deYYY XXX?,¿Quién fue el director de XXX?
P57        ,director                                        ,Who was the director for XXX?                                          ,¿Quién fue el director de XXX?                                                   ,,¿Quién fue el director de XXX?
P57        ,director                                        ,Who was XXX directed by?                                               ,¿A quién fue dirigido XXX?                                                       ,,¿A quién fue dirigido XXX?
P57        ,director                                        ,Who is the director for XXX?                                           ,¿Quién es el director de XXX?                                                    ,¿Quién es el director deYYY XXX?,¿Quién es el director de XXX?
P57        ,director                                        ,Who had the role of director in XXX?                                   ,¿Quién tuvo el papel de director en XXX?                                         ,,¿Quién tuvo el papel de director en XXX?
P57        ,director                                        ,Who directed the film XXX?                                             ,¿Quién dirigió la película XXX?                                                  ,¿Quién dirigió la película YYY XXX?,¿Quién dirigió la película XXX?
P57        ,director                                        ,Who directed XXX?                                                      ,¿Quién dirigió XXX?                                                              ,¿Quién dirigió YYY XXX?,¿Quién dirigió XXX?
P57        ,director                                        ,Which director worked on XXX?                                          ,¿Qué director trabajó en XXX?                                                    ,¿Qué director trabajó en YYY XXX?,¿Qué director trabajó en XXX?
P57        ,director                                        ,What was the name of the director for XXX?                             ,¿Cuál era el nombre del director para XXX?                                       ,¿Cuál era el nombre del director de YYY XXX?,¿Cuál era el nombre del director para XXX?
P57        ,director                                        ,What is the director of XXX?                                           ,¿Cuál es el director de XXX?                                                     ,¿Quién es el director de YYY XXX?,¿Cuál es el director de XXX?
P57        ,director                                        ,What is the name of the director of XXX?                               ,¿Cuál es el nombre del director de XXX?                                          ,,¿Cuál es el nombre del director de XXX?
P57        ,director                                        ,Who is the director of the film XXX?                                   ,¿Quién es el director de la película XXX?                                        ,,¿Quién es el director de la película XXX?
P57        ,director                                        ,Who is the director of XXX?                                            ,¿Quién es el director de XXX?                                                    ,,¿Quién es el director de XXX?
P57        ,director                                        ,Which director helmed the movie XXX?                                   ,¿Qué director dirigió la película XXX?                                           ,¿Qué director dirigió la película YYY XXX?,¿Qué director dirigió la película XXX?
P57        ,director                                        ,The director of XXX is who?                                            ,El director de XXX es quién?                                                     ,,El director de XXX es quién?
P57        ,director                                        ,Under whose direction was XXX produced?                                ,¿Bajo qué dirección fue producido XXX?                                           ,,¿Bajo qué dirección fue producido XXX?
P57        ,director                                        ,The film XXX was directed by who?                                      ,La película XXX fue dirigida por quién?                                          ,,La película XXX fue dirigida por quién?
P57        ,director                                        ,Who was responsible for the direction of XXX?                          ,¿Quién fue responsable de la dirección de XXX?                                   ,,¿Quién fue responsable de la dirección de XXX?
P57        ,director                                        ,Who id the director for XXX?                                           ,¿Quién identificó al director para XXX?                                          ,,¿Quién identificó al director para XXX?
P57        ,director                                        ,The main director of XXX was who?                                      ,El director principal de XXX fue quien?                                          ,,El director principal de XXX fue quien?
P57        ,director                                        ,The director of XXX is what?                                           ,¿El director de XXX es qué?                                                      ,,¿El director de XXX es qué?
P57        ,director                                        ,Whose direction is XXX?                                                ,¿De quién es la dirección XXX?                                                   ,,¿De quién es la dirección XXX?
P57        ,director                                        ,Who was XXX was directed by?                                           ,¿Quién fue XXX fue dirigido por?                                                 ,,¿Quién fue XXX fue dirigido por?
P57        ,director                                        ,Who served as director for XXX?                                        ,¿Quién sirvió como director para XXX?                                            ,,¿Quién sirvió como director para XXX?
P57        ,director                                        ,XXX a 2001 german drama film directed by ?                             ,XXX una película de drama alemán 2001 dirigida por?                              ,,XXX una película de drama alemán 2001 dirigida por?
P61        ,discoverer or inventor                          ,Who was the discoverer of XXX?                                         ,¿Quién fue el descubridor de XXX?                                                ,¿Quién fue el descubridor deYYY XXX?,¿Quién fue el descubridor de XXX?
P61        ,discoverer or inventor                          ,Who was the original discoverer of XXX?                                ,¿Quién fue el descubridor original de XXX?                                       ,¿Quién fue el descubridor original deYYY XXX?,¿Quién fue el descubridor original de XXX?
P61        ,discoverer or inventor                          ,Who discovered XXX?                                                    ,¿Quién descubrió XXX?                                                            ,¿Quién descubrió YYY XXX?,¿Quién descubrió XXX?
P61        ,discoverer or inventor                          ,By whom was XXX discovered?                                            ,¿Por quién fue descubierto XXX?                                                  ,¿Por quién fue descubiertGGG YYY XXX?,¿Por quién fue descubierto XXX?
P61        ,discoverer or inventor                          ,Who made the discovery of XXX?                                         ,¿Quién hizo el descubrimiento de XXX?                                            ,,¿Quién hizo el descubrimiento de XXX?
P61        ,discoverer or inventor                          ,Who made XXX known?                                                    ,¿Quién dio a conocer a XXX?                                                      ,,¿Quién dio a conocer a XXX?
P61        ,discoverer or inventor                          ,What is the name of the person who discovered XXX?                     ,¿Cuál es el nombre de la persona que descubrió XXX?                              ,,¿Cuál es el nombre de la persona que descubrió XXX?
P61        ,discoverer or inventor                          ,Who was responsible for the discovery of XXX?                          ,¿Quién fue el responsable del descubrimiento de XXX?                             ,¿Quién fue el responsable del descubrimiento deYYY XXX?,¿Quién fue el responsable del descubrimiento de XXX?
